"Я не готую так добре, як ти.","Я не готую так добре, як ти готуєш."
"Ми поїдемо до парку машиною, а вони велосипедом.","Ми поїдемо до парку машиною, а вони поїдуть велосипедом."
"В Україні зараз борються з ворогами, а зараз в Америці одне з одним.","В Україні зараз борються з ворогами, а зараз в Америці борються одне з одним."
"Вона встала й вийшла, але ії чоловік не знав чому.","Вона встала й вийшла, але ії чоловік не знав чому вона встала й вийшла."
"Я не хотів, але учора ми ходили в кіно.","Я не хотів ходити в кіно, але учора ми ходили в кіно."
"Хочу поїхати за кордон, але не знаю куди.","Хочу поїхати за кордон, але не знаю куди поїхати."
"Там я уперше спробував сало, й ти теж.","Там я уперше спробував сало, й ти там уперше спробувала сало теж."
"Вони запрошували мене піти на озеро, але я не мав часу.","Вони запрошували мене піти на озеро, але я не мав часу піти на озеро."
"По понеділкам я ходжу з лекції до магазину вранці, а по п'ятницям ввечері.","По понеділкам я ходжу з лекції до магазину вранці, а по п'ятницям я ходжу з лекції до магазину ввечері."
"Чоловік описує якесь місто, але нам неясно, яке.","Чоловік описує якесь місто, але нам неясно, яке місто чоловік описує."
"Добрі студенти завжди роблять домашне завдання, а погані студенти ніколи.","Добрі студенти завжди роблять домашне завдання, а погані студенти ніколи не роблять домашне завдання."
"В Америці ми прикрашаемо ялку на Різдво, а в Россії на Новий рік.","В Америці ми прикрашаемо ялку на Різдво, а в Россії прикрашають ялку на Новий рік."
"Краще втратити цілий день, ніж цілий тиждень.","Краще втратити цілий день, ніж втратити цілий тиждень."
"Він завжди замовляє холодні страви, а вона гарячі.","Він завжди замовляє холодні страви, а вона завжди замовляє гарячі страви."
"Іван посміхається, і Михайло знає чому?","Іван посміхається, і Михайло знає чому Іван посміхається?"
"Я розмовляю голосніше, ніж Іван.","Я розмовляю голосніше, ніж Іван розмовляє."
"Батько не їсть зелену цібулю, тільки червону.","Батько не їсть зелену цібулю, батько їсть тільки червону цібулю."
"Щороку я перечитуваю ""Володара перснів"", а моя сестра ""Гобіта"".","Щороку я перечитуваю ""Володара перснів"", а моя сестра перечитуває ""Гобіта""."
"Щодня вранці батько їсть пластівці, і ввечері також.","Щодня вранці батько їсть пластівці, і щодня ввечері батько їсть пластівці також."
"Він добре розуміє математику, й біологію також.","Він добре розуміє математику, й він добре розуміє біологію також."
"Ці квитки на концерт було куплено для нас, а не для вас.","Ці квитки на концерт було куплено для нас, а ці квитки на концерт не було куплено для вас."
"Я приправлю суп паприкою, а ти чорним перцем.","Я приправлю суп паприкою, а ти приправиш чорним перцем."
"Я не можу бачити без окуларів, а моя дівчина може.","Я не можу бачити без окуларів, а моя дівчина може бачити без окуларів."
"Я не їм стільки, як він.","Я не їм стільки, як він їсть."
"Я сьогодні розмовляю голосніше, ніж Іван учора.","Я сьогодні розмовляю голосніше, ніж Іван розмовляв учора."
"Вони купили надувний замок, але не ясно кому.","Вони купили надувний замок, але не ясно кому вони купили надувний замок."
"Я їм більше фруктів, ніж овочів.","Я їм більше фруктів, ніж я їм овочів."
"Я не вмію танцювати, а мій брат плавати.","Я не вмію танцювати, а мій брат не вміє плавати."
"Ми прийшли сюди тому, що ми хотіли.","Ми прийшли сюди тому, що ми хотіли прийти сюди."
"Мені подобаються майже всі страви з цього індійського ресторану, і моїй дівчині теж.","Мені подобаються майже всі страви з цього індійського ресторану, і моїй дівчині теж подобаються майже всі страви з цього індійського ресторану."
"Моя дочка хоче стати не просто простою бізнесменкою, а найбагатшою у світі.","Моя дочка хоче стати не просто простою бізнесменкою, а моя дочка хоче стати найбагатшою бізнесменкою у світі."
"Перший космонавт з Радянського Союза полетів у космос 12 квітня, 1961, а перший з США 5 травня 1961.","Перший космонавт з Радянського Союза полетів у космос 12 квітня, 1961, а перший астронавт з США полетів у космос 5 травня 1961."
"Він сумнівається, що колись виграє у лото, але все одно сподівається.","Він сумнівається, що колись виграє у лото, але все одно сподівається колись виграти у лото."
"Моя дівчина завжди хоче ходити в кіно, а я николі не хочу.","Моя дівчина завжди хоче ходити в кіно, а я николі не хочу ходити в кіно."
"Учора тут падав дощ, а не сніг.","Учора тут падав дощ, а учора тут падав не сніг."
"Він має уродини у червні, а вона у жовтні.","Він має уродини у червні, а вона має уродини у жовтні."
"Подруга завжди рекомендує мені нову музику, але я ще слухаю стару.","Подруга завжди рекомендує мені нову музику, але я ще слухаю стару музику."
"Григорій готує макарони, а Олена песто.","Григорій готує макарони, а Олена готує песто."
"Жуков вів свою армію на Берлін з півночі, а Конєв з півдня.","Жуков вів свою армію на Берлін з півночі, а Конєв вів свою армію на Берлін з півдня."
"У минулому році ми вирощували тільки картоплю, але у цьому році і картоплю, і огірки.","У минулому році ми вирощували тільки картоплю, але у цьому році вирощуємо і картоплю, і огірки."
"Я зробив канапку учора вранці, й потім ще раз ввечері.","Я зробив канапку учора вранці, й потім ще раз я зробив канапку ввечері."
"Федір часто знайомиться з новими людьми, а Олена рідко.","Федір часто знайомиться з новими людьми, а Олена знайомиться з новими людьми рідко."
"У дитинстві я грав у баскетбол, а мій приятель у бейсбол.","У дитинстві я грав у баскетбол, а у дитинстві мій приятель грав у бейсбол."
"Лідія переїде в Харків, а ії сестра в Одесу.","Лідія переїде в Харків, а ії сестра переїде в Одесу."
"Хоч ми хотіли порушити закон, ми не наважилися.","Хоч ми хотіли порушити закон, ми не наважилися порушити закон."
"Вона знає більше про свою країну, ніж він.","Вона знає більше про свою країну, ніж він знає про ії країну."
"Журавлі літають швидше, ніж голуби.","Журавлі літають швидше, ніж голуби літають."
"Мені подобаються майже всі страви з цього індійського ресторану, а моїй дівчині тільки одна.","Мені подобаються майже всі страви з цього індійського ресторану, а моїй дівчині подобається тільки одна страва з цього індійського ресторану."
"Я про все шкодую, а батько ні про що.","Я про все шкодую, а батько ні про що не шкодує."
"Вона вмерла у 1975, а ії чоловік на рік пізніше у 1976.","Вона вмерла у 1975, а ії чоловік вмер на рік пізніше у 1976."
"Я більше п'ю віскі, ніж він горілку.","Я більше п'ю віскі, ніж він п'є горілку."
"Лідія каже, що Іван видалив файли випадково, а Марія каже, що навмисно.","Лідія каже, що Іван видалив файли випадково, а Марія каже, що Іван видалив файли навмисно."
"Я підготую матеріали на понеділок, а ти на вівторок.","Я підготую матеріали на понеділок, а ти підготуєш матеріали на вівторок."
"Ми дуже хочемо подорожувати Україною, але зараз не можемо.","Ми дуже хочемо подорожувати Україною, але зараз не можемо подорожувати Україною."
"Сьогодні підемо в бар, але мені ще не сказали коли.","Сьогодні підемо в бар, але мені ще не сказали коли підемо в бар."
"Моя мати хоче новий комп'ютер, але ще не знає, якого бренду.","Моя мати хоче новий комп'ютер, але моя мати ще не знає, якого бренду моя мати хоче комп'ютер."
"Він говорить з чужим акцентом, але ми не знаємо чому.","Він говорить з чужим акцентом, але ми не знаємо чому він говорить з чужим акцентом."
"Я розбив чашку, а сестра тарілку.","Я розбив чашку, а сестра розбила тарілку."
"Я приготував питання не тільки до Радослава, але й до Яни.","Я приготував питання не тільки до Радослава, але й я приготував питання до Яни."
"Розмоляю українською, але не дуже добре.","Розмоляю українською, але не дуже добре розмоляю українською."
"Мій брат думає, що краще полювати з луком, ніж з гвинтівкою.","Мій брат думає, що краще полювати з луком, ніж полювати з гвинтівкою."
"Я розмовляю голосніше англійскою, ніж українською.","Я розмовляю голосніше англійскою, ніж я розмовляю українською."
Багато?,Багато п'ють німци пиво?
"Чи не можеш відповісти, чи просто просто не хочеш?","Чи не можеш відповісти, чи просто просто не хочеш відповісти?"
"Я в'їхав велосипедом у машину не два рази, а три.","Я в'їхав велосипедом у машину не два рази, а я в'їхав велосипедом у машину три рази."
"Я добре розумію математику, але не біологію.","Я добре розумію математику, але я не добре розумію біологію."
"Моя мати працює не тільки вдень, а і ввечері.","Моя мати працює не тільки вдень, а і працює ввечері."
"Моя дружина завжди приймає душ вранці, а я ввечері.","Моя дружина завжди приймає душ вранці, а я завжди приймаю душ ввечері."
"На Різдво моя сестра готує вареники з картоплею, а я з м'ясом.","На Різдво моя сестра готує вареники з картоплею, а на Різдво я готую вареники з м'ясом."
"Сорочка мені трошки завелика, а штани замалі.","Сорочка мені трошки завелика, а штани мені трошки замалі."
"Там я уперше спробував сало, й ти теж.","Там я уперше спробував сало, й ти там уперше спробував сало теж."
"Я хотів чай з Китаю, не з Індії.","Я хотів чай з Китаю, я не хотів чай з Індії."
"Я не вмію готувати так добре, як ти.","Я не вмію готувати так добре, як ти вмієш готувати."
"Чоловік описує якесь місто, але нам незрозуміло, яке.","Чоловік описує якесь місто, але нам незрозуміло, яке місто чоловік описує."
"Коти бавляться малими іграшками, а пси великими.","Коти бавляться малими іграшками, а пси бавляться великими іграшками."
Чому?,Чому Іван стрибнув у криницю?
"Демократи голосують за законопроєкт, а республиканці проти.","Демократи голосують за законопроєкт, а республиканці голосують проти законопроєкту."
Вона вважає його доброю людиною і він ії.,Вона вважає його доброю людиною і він вважає ії доброю людиною.
"Там я уперше спробував сало, а ти зрази.","Там я уперше спробував сало, а ти там уперше спробувала зрази."
"Закон в США забороняє володіння наркотиками, не вживання.","Закон в США забороняє володіння наркотиками, закон в США забороняє не вживання наркотиків."
"У зоопарку моя мати завжди любить дивитися на тюленів, а мій батько на пінгвінів.","У зоопарку моя мати завжди любить дивитися на тюленів, а мій батько завжди любить дивитися на пінгвінів."
"Я вмію керувати човном, але не літаком.","Я вмію керувати човном, але не вмію керувати літаком."
"У зоопарку я люблю дивитися на слонів, і мої сестри теж.","У зоопарку я люблю дивитися на слонів, і мої сестри теж люблять дивитися на слонів."
Тоді яке?!,Тоді яке морозиво хочеш?!
"Іван пише книгу, а Микола музику.","Іван пише книгу, а Микола пише музику."
"В англійській мові неможливо зробити складний іменник з 20-и слів, а в німецкій можливо.","В англійській мові неможливо зробити складний іменник з 20-и слів, а в німецкій мові можливо зробити складний іменник з 20-и слів."
"Завтра я принесу лід, а ти пиво.","Завтра я принесу лід, а ти принесеш пиво."
"Максимові подобається шоколад, а Галині цукерки.","Максимові подобається шоколад, а Галині подобаються цукерки."
"Вона вбила його, але чим не знаємо.","Вона вбила його, але чим вона вбила його не знаємо."
"Павло грає на скрипці, Данило на віолончелі а Петро роялі.","Павло грає на скрипці, Данило грає на віолончелі а Петро грає роялі."
"Я не вмію танцювати танґо, але хочу навчитися.","Я не вмію танцювати танґо, але я хочу навчитися танцювати танґо."
"Я волію їсти зрази з яловичини, а ти з свинини.","Я волію їсти зрази з яловичини, а ти волієш їсти зрази з свинини."
"На цій плантації вирощують, збирають, і обробляють алое, а на цій тютюн.","На цій плантації вирощують, збирають, і обробляють алое, а на цій плантації вирощують, збирають, і обробляють тютюн."
"Я сьогодні розмовляю голосніше, ніж учора.","Я сьогодні розмовляю голосніше, ніж я розмовляв учора."
Я ненавиджу Марка і тебе теж.,Я ненавиджу Марка і тебе теж ненавиджу.
"Ми дуже хочемо подорожувати по Україні, але зараз не можемо.","Ми дуже хочемо подорожувати по Україні, але зараз не можемо подорожувати по Україні."
"Ми хочемо піти на екскурсію до музею, а ви до театру.","Ми хочемо піти на екскурсію до музею, а ви хочете піти на екскурсію до театру."
"Я його люблю, але не так сильно.","Я його люблю, але я його люблю не так сильно."
"Його вбили, але не знаю чому.","Його вбили, але не знаю чому його вбили."
"Я поставив йому три питання, і ти теж.","Я поставив йому три питання, і ти теж поставила йому три питання."
"Іван щодня грає у футбол, і я теж.","Іван щодня грає у футбол, і я теж щодня граю у футбол."
"Щодня вранці батько їсть пластівці, а ввечері стейк.","Щодня вранці батько їсть пластівці, а щодня ввечері батько їсть стейк."
"Це речення вважається в англійській мові неправильним, але в українській правильним.","Це речення вважається в англійській мові неправильним, але це речення вважається в українській мові правильним."
"Ніколи не хочу користуватися духовкою, тому що важко.","Ніколи не хочу користуватися духовкою, тому що користуватися духовкою важко."
"Там я уперше спробував сало, а ти зрази.","Там я уперше спробував сало, а ти там уперше спробував зрази."
"США офіційно проголосили незалежність від Велико-Британії у 1783 році, а Україна від Радянського Союза у 1991 році.","США офіційно проголосили незалежність від Велико-Британії у 1783 році, а Україна офіційно проголосила від Радянського Союза у 1991 році."
"Я поставив йому три питання, і тобі теж.","Я поставив йому три питання, і я поставив тобі три питання теж."
"Я волію слухати його старі пісні, а не нові.","Я волію слухати його старі пісні, а я не волію слухати його нові пісні."
Батькові.,Батькові вони купили цю машину.
"Вони прийшли до мене не у середу, а у четверг.","Вони прийшли до мене не у середу, а вони прийшли до мене у четверг."
"Я їм більше фруктів, ніж Михайло.","Я їм більше фруктів, ніж Михайло їсть фрукти."
"Мені учора щось снилося, але не памятаю що.","Мені учора щось снилося, але не памятаю що мені снилося."
"Я був на канікулах у Франції, сестра в Ірландії, а мої батьки у Швеції.","Я був на канікулах у Франції, сестра була на канікулах в Ірландії, а мої батьки були на канікулах у Швеції."
"Максимові подобається чай, а Галині кава.","Максимові подобається чай, а Галині подобається кава."
"Вони зараз розмовляють українською мовою, не російською.","Вони зараз розмовляють українською мовою, вони зараз не розмовляють російською."
"Іра не така модна, як Юля.","Іра не така модна, як Юля модна."
"У дитинстві я їв багато морозива, але зараз мало.","У дитинстві я їв багато морозива, але зараз я їм мало морозива."
"Я поставив йому три питання, а їй тільки два.","Я поставив йому три питання, а я поставив їй тільки два питання."
"Віра й Олена читають газету, а Борис книгу.","Віра й Олена читають газету, а Борис читає книгу."
