"Чоловік описує якесь місто, але нам незрозуміло, яке.","Чоловік описує якесь місто, але нам незрозуміло, яке місто чоловік описує."
"Мені треба прибрати кімнату для гостей сьогодні, а тобі завтра.","Мені треба прибрати кімнату для гостей сьогодні, а тобі треба прибрати кімнату для гостей завтра."
"Він має уродини у червні, а вона у жовтні.","Він має уродини у червні, а вона має уродини у жовтні."
"Я хотів кращу шапку, не цю.","Я хотів кращу шапку, я не хотів цю шапку."
Кожен рік він випадково розбиває чашку і його мати теж.,Кожен рік він випадково розбиває чашку і його мати теж кожен рік випадково розбиває чашку.
"Я поставив йому три питання, і тобі теж.","Я поставив йому три питання, і я поставив тобі три питання теж."
"Вона встала й вийшла, але ії чоловік не знав чому.","Вона встала й вийшла, але ії чоловік не знав чому вона встала й вийшла."
"Він придумав мелодію песни, а вона текст.","Він придумав мелодію песни, а вона придумав текст песни."
"У понеділок ми читали першу частину роману, а у вівторок другу.","У понеділок ми читали першу частину роману, а у вівторок ми читали другу частину роману."
"Мені подобається ця пісня, але не знаю чому.","Мені подобається ця пісня, але не знаю чому мені подобається ця пісня."
"Він завжди замовляє холодні страви, а вона гарячі.","Він завжди замовляє холодні страви, а вона завжди замовляє гарячі страви."
"Вона знає більше про свою країну, ніж він.","Вона знає більше про свою країну, ніж він знає про ії країну."
"В Україні зараз борються з ворогами, а зараз в Америці одне з одним.","В Україні зараз борються з ворогами, а зараз в Америці борються одне з одним."
"Федір часто знайомиться з новими людьми, а Олена рідко.","Федір часто знайомиться з новими людьми, а Олена знайомиться з новими людьми рідко."
"Я спочатку приправлю суп паприкою, а потім чорним перцем.","Я спочатку приправлю суп паприкою, а потім я приправлю суп чорним перцем."
"У 1950-ому році у Детройті мешкало понад 1,8 мільйона осіб, а вже у 2000-ому році менше мільйона.","У 1950-ому році у Детройті мешкало понад 1,8 мільйона осіб, а вже у 2000-ому році у Детройті мешкало менше мільйона."
"Він говорить з чужим акцентом, але ми не знаємо чому.","Він говорить з чужим акцентом, але ми не знаємо чому він говорить з чужим акцентом."
"Я поставив йому три питання, а їй тільки два.","Я поставив йому три питання, а я поставив їй тільки два питання."
"Офіцери носять кашкети, а солдати прості пілотки.","Офіцери носять кашкети, а солдати носять прості пілотки."
"Іван посміхається, і Михайло знає чому?","Іван посміхається, і Михайло знає чому Іван посміхається?"
"Лідія каже, що Іван видалив файли випадково, а Марія каже, що навмисно.","Лідія каже, що Іван видалив файли випадково, а Марія каже, що Іван видалив файли навмисно."
"Я вмію керувати човном, але не літаком.","Я вмію керувати човном, але не вмію керувати літаком."
"Я їм більше фруктів, ніж Михайло.","Я їм більше фруктів, ніж Михайло їсть фрукти."
"Ці квитки на концерт було куплено для нас, а не для вас.","Ці квитки на концерт було куплено для нас, а ці квитки на концерт не було куплено для вас."
"Мені учора щось снилося, але не памятаю що.","Мені учора щось снилося, але не памятаю що мені снилося."
"Я не вмію готувати так добре, як ти.","Я не вмію готувати так добре, як ти вмієш готувати."
"Він добре розуміє математику, й біологію також.","Він добре розуміє математику, й він добре розуміє біологію також."
"Максимові подобається чай, а Галині кава.","Максимові подобається чай, а Галині подобається кава."
"Він сумнівається, що колись виграє у лото, але все одно сподівається.","Він сумнівається, що колись виграє у лото, але все одно сподівається, що колись виграє у лото."
Я ненавиджу Марка і тебе теж.,Я ненавиджу Марка і тебе теж ненавиджу.
"В англійській мові неможливо зробити складний іменник з 20-и слів, а в німецкій можливо.","В англійській мові неможливо зробити складний іменник з 20-и слів, а в німецкій мові можливо зробити складний іменник з 20-и слів."
"Я волію їсти зрази з яловичини, а ти з свинини.","Я волію їсти зрази з яловичини, а ти волієш їсти зрази з свинини."
"Григорій мешкає у Львові, а Дмитро у Києві.","Григорій мешкає у Львові, а Дмитро мешкає у Києві."
"Краще втратити цілий день, ніж цілий тиждень.","Краще втратити цілий день, ніж втратити цілий тиждень."
"Я зробив одну канапку уранці, й потім ще одну увечері.","Я зробив одну канапку уранці, й потім ще одну канапку зробив я увечері."
"Я не їм стільки, як він.","Я не їм стільки, як він їсть."
"Подруга завжди рекомендує мені нову музику, але я ще слухаю стару.","Подруга завжди рекомендує мені нову музику, але я ще слухаю стару музику."
"Там я уперше спробував сало, а ти зрази.","Там я уперше спробував сало, а ти там уперше спробувала зрази."
