"Це речення вважається в англійській мові неправильним, але в українській правильним.","Це речення вважається в англійській мові неправильним, але це речення вважається в українській мові правильним."
"Я поставив йому три питання, і ти теж.","Я поставив йому три питання, і ти теж поставив йому три питання."
"Щодня вранці батько їсть пластівці, а ввечері стейк.","Щодня вранці батько їсть пластівці, а щодня ввечері батько їсть стейк."
"Я хотів чай з Китаю, не з Індії.","Я хотів чай з Китаю, я не хотів чай з Індії."
"Вона вбила його, але чим не знаємо.","Вона вбила його, але чим вона вбила його не знаємо."
"Він добре готує суп з м'ясом, а вона без мяса.","Він добре готує суп з м'ясом, а вона добре готує суп без мяса."
"Я приготував питання не тільки до Радослава, але й до Яни.","Я приготував питання не тільки до Радослава, але й я приготував питання до Яни."
"Перша людина з Радянського Союза полетіла у космос 12 квітня, 1961, а перша з США 5 травня 1961.","Перша людина з Радянського Союза полетіла у космос 12 квітня, 1961, а перша людина з США полетіла у космос 5 травня 1961."
"Демократи голосують за законопроєкт, а республиканці проти.","Демократи голосують за законопроєкт, а республиканці голосують проти законопроєкту."
"Я не хотів, але учора ми ходили в кіно.","Я не хотів ходити в кіно, але учора ми ходили в кіно."
"Сьогодні підемо в бар, але мені ще не сказали коли.","Сьогодні підемо в бар, але мені ще не сказали коли підемо в бар."
"Вони зараз розмовляють українською мовою, не російською.","Вони зараз розмовляють українською мовою, вони зараз не розмовляють російською."
"Незнайомий дав мені подарунок, але не знаю за що.","Незнайомий дав мені подарунок, але не знаю за що він дав мені подарунок."
"На Різдво моя сестра готує вареники з картоплею, а я з м'ясом.","На Різдво моя сестра готує вареники з картоплею, а на Різдво я готую вареники з м'ясом."
"Вони ненавидять наш дім, але люблять свій.","Вони ненавидять наш дім, але вони люблять свій дім."
"Іван грає у футбол щодня, а я раз на місяць.","Іван грає у футбол щодня, а я граю у футбол раз на місяць."
"Я більше п'ю віскі, ніж він горілку.","Я більше п'ю віскі, ніж він п'є горілку."
"Завтра я принесу лід, а ти пиво.","Завтра я принесу лід, а ти принесеш пиво."
"Ми дуже хочемо подорожувати Україною, але зараз не можемо.","Ми дуже хочемо подорожувати Україною, але зараз не можемо подорожувати Україною."
Тоді яке?!,Тоді яке морозиво хочеш?!
"Мій брат думає, що краще полювати з луком, ніж з гвинтівкою.","Мій брат думає, що краще полювати з луком, ніж полювати з гвинтівкою."
"Я його люблю, але не так сильно.","Я його люблю, але я його люблю не так сильно."
"Його вбили, але не знаю чому.","Його вбили, але не знаю чому його вбили."
"Вона знає більше про свою країну, ніж він.","Вона знає більше про свою країну, ніж він знає про свою країну."
"Моя дочка хоче стати не просто простою бізнесменкою, а найбагатшою у світі.","Моя дочка хоче стати не просто простою бізнесменкою, а моя дочка хоче стати найбагатшою бізнесменкою у світі."
"Я сьогодні розмовляю голосніше, ніж Іван учора.","Я сьогодні розмовляю голосніше, ніж Іван розмовляв учора."
Я ненавиджу Марка і ти теж.,Я ненавиджу Марка і ти теж ненавиджиш Марка.
"Я не вмію танцювати, а мій брат плавати.","Я не вмію танцювати, а мій брат не вміє плавати."
"Закон в США забороняє володіння наркотиками, не вживання.","Закон в США забороняє володіння наркотиками, закон в США забороняє не вживання наркотиків."
"Щодня вранці батько їсть пластівці, і ввечері також.","Щодня вранці батько їсть пластівці, і щодня ввечері батько їсть пластівці також."
"Розмоляю українською, але не дуже добре.","Розмоляю українською, але не дуже добре розмоляю українською."
"Іван щодня грає у футбол, а я в теніс.","Іван щодня грає у футбол, а я щодня граю в теніс."
"Я в'їхав велосипедом у машину не два рази, а три.","Я в'їхав велосипедом у машину не два рази, а я в'їхав велосипедом у машину три рази."
"До піци я завжди додаю цібулю, а моя дівчина перець.","До піци я завжди додаю цібулю, а моя дівчина завжди додає перець."
"Я їм більше фруктів, ніж овочів.","Я їм більше фруктів, ніж я їм овочів."
"Він відремонтував моє авто, але я не розумію як.","Він відремонтував моє авто, але я не розумію як він відремонтував моє авто."
"В Америці ми прикрашаемо ялку на Різдво, а в Россії на Новий рік.","В Америці ми прикрашаемо ялку на Різдво, а в Россії прикрашають ялку на Новий рік."
"Щось купили на ринку, але ще не сказали що.","Щось купили на ринку, але ще не сказали що купили."
"Данило та Павло використовують у спортзалі великі гантелі, а Іван малі.","Данило та Павло використовують у спортзалі великі гантелі, а Іван використовує у спортзалі малі гантелі."
"Там я уперше спробував сало, й ти теж.","Там я уперше спробував сало, й ти там уперше спробувала сало теж."
"Моя мати хоче новий комп'ютер, але ще не знає, якого бренду.","Моя мати хоче новий комп'ютер, але моя мати ще не знає, якого бренду моя мати хоче комп'ютер."
"Григорій готує макарони, а Олена песто.","Григорій готує макарони, а Олена готує песто."
"Я зробив канапку учора вранці, й потім ще раз ввечері.","Я зробив канапку учора вранці, й потім ще раз я зробив канапку ввечері."
"Ми дуже хочемо подорожувати по Україні, але зараз не можемо.","Ми дуже хочемо подорожувати по Україні, але зараз не можемо подорожувати по Україні."
"Журавлі літають швидше, ніж голуби.","Журавлі літають швидше, ніж голуби літають."
"Іра не така модна, як Юля.","Іра не така модна, як Юля модна."
"Мені подобаються майже всі страви з цього індійського ресторану, і моїй дівчині теж.","Мені подобаються майже всі страви з цього індійського ресторану, і моїй дівчині теж подобаються майже всі страви з цього індійського ресторану."
"У дитинстві я їв багато морозива, але зараз мало.","У дитинстві я їв багато морозива, але зараз я їм мало морозива."
"Хоч ми хотіли порушити закон, ми не наважилися.","Хоч ми хотіли порушити закон, ми не наважилися порушити закон."
"По понеділкам я ходжу з лекції до магазину вранці, а по п'ятницям ввечері.","По понеділкам я ходжу з лекції до магазину вранці, а по п'ятницям я ходжу з лекції до магазину ввечері."
"У минулому році ми вирощували тільки картоплю, але у цьому році і картоплю, і огірки.","У минулому році ми вирощували тільки картоплю, але у цьому році вирощуємо і картоплю, і огірки."
"Ми хочемо піти на екскурсію до музею, а ви до театру.","Ми хочемо піти на екскурсію до музею, а ви хочете піти на екскурсію до театру."
"Я приправлю суп паприкою, а ти чорним перцем.","Я приправлю суп паприкою, а ти приправиш чорним перцем."
"Учора тут падав дощ, а не сніг.","Учора тут падав дощ, а учора тут падав не сніг."
"Я волію слухати його старі пісні, а не нові.","Я волію слухати його старі пісні, а я не волію слухати його нові пісні."
"Батько не їсть зелену цібулю, тільки червону.","Батько не їсть зелену цібулю, батько їсть тільки червону цібулю."
"США офіційно проголосили незалежність від Велико-Британії у 1783 році, а Україна від Радянського Союза у 1991 році.","США офіційно проголосили незалежність від Велико-Британії у 1783 році, а Україна офіційно проголосила від Радянського Союза у 1991 році."
"Максимові подобається шоколад, а Галині цукерки.","Максимові подобається шоколад, а Галині подобаються цукерки."
"Вони сміються, але не знаємо над ким.","Вони сміються, але не знаємо над ким вони сміються."
"Я про все шкодую, а батько ні про що.","Я про все шкодую, а батько ні про що не шкодує."
Батькові.,Батькові вони купили цю машину.
"Вони прийшли до мене не у середу, а у четверг.","Вони прийшли до мене не у середу, а вони прийшли до мене у четверг."
"Щороку я перечитуваю ""Володара перснів"", а моя сестра ""Гобіта"".","Щороку я перечитуваю ""Володара перснів"", а моя сестра перечитуває ""Гобіта""."
"Там я уперше спробував сало, а ти зрази.","Там я уперше спробував сало, а ти там уперше спробував зрази."
"Іван щодня грає у футбол, і я теж.","Іван щодня грає у футбол, і я теж щодня граю у футбол."
"Моя мати хоче новий комп'ютер, але ще не знає, який.","Моя мати хоче новий комп'ютер, але моя мати ще не знає, який моя мати хоче комп'ютер."
"Я люблю пиво, а ти вино.","Я люблю пиво, а ти любиш вино."
"Моя мати працює не тільки вдень, а і ввечері.","Моя мати працює не тільки вдень, а і працює ввечері."
"Віра й Олена читають газету, а Борис книгу.","Віра й Олена читають газету, а Борис читає книгу."
"Коти бавляться малими іграшками, а пси великими.","Коти бавляться малими іграшками, а пси бавляться великими іграшками."
"У дитинстві я грав у баскетбол, а мій приятель у бейсбол.","У дитинстві я грав у баскетбол, а у дитинстві мій приятель грав у бейсбол."
"Хочу поїхати за кордон, але не знаю куди.","Хочу поїхати за кордон, але не знаю куди поїхати."
"Вони можуть бігати швидше, ніж я.","Вони можуть бігати швидше, ніж я можу бігати."
"Мені подобаються майже всі страви з цього індійського ресторану, а моїй дівчині тільки одна.","Мені подобаються майже всі страви з цього індійського ресторану, а моїй дівчині подобається тільки одна страва з цього індійського ресторану."
"Вона мене не любить, а я ії.","Вона мене не любить, а я ії не люблю."
Чому?,Чому Іван стрибнув у криницю?
"Моя дівчина завжди хоче ходити в кіно, а я николі не хочу.","Моя дівчина завжди хоче ходити в кіно, а я николі не хочу ходити в кіно."
"Я добре розумію математику, але не біологію.","Я добре розумію математику, але я не добре розумію біологію."
Багато?,Багато п'ють німци пиво?
"Він сумнівається, що колись виграє у лото, але все одно сподівається.","Він сумнівається, що колись виграє у лото, але все одно сподівається колись виграти у лото."
"Вона вмерла у 1975, а ії чоловік на рік пізніше у 1976.","Вона вмерла у 1975, а ії чоловік вмер на рік пізніше у 1976."
"Я приготував питання не тільки Радославу, але й Яні.","Я приготував питання не тільки Радославу, але й я приготував питання Яні."
"Я був на канікулах у Франції, сестра в Ірландії, а мої батьки у Швеції.","Я був на канікулах у Франції, сестра була на канікулах в Ірландії, а мої батьки були на канікулах у Швеції."
"Він має уродини у червні, і вона теж.","Він має уродини у червні, і вона теж має уродини у червні."
Вона вважає його доброю людиною і він ії.,Вона вважає його доброю людиною і він вважає ії доброю людиною.
"Я збираюся купити машину, а ти продати.","Я збираюся купити машину, а ти збираєшся продати машину."
"На цій плантації вирощують, збирають, і обробляють алое, а на цій тютюн.","На цій плантації вирощують, збирають, і обробляють алое, а на цій плантації вирощують, збирають, і обробляють тютюн."
"Моя дружина завжди приймає душ вранці, а я ввечері.","Моя дружина завжди приймає душ вранці, а я завжди приймаю душ ввечері."
"Ми прийшли сюди тому, що ми хотіли.","Ми прийшли сюди тому, що ми хотіли прийти сюди."
"Я не вмію танцювати танґо, але хочу навчитися.","Я не вмію танцювати танґо, але я хочу навчитися танцювати танґо."
"Перший космонавт з Радянського Союза полетів у космос 12 квітня, 1961, а перший з США 5 травня 1961.","Перший космонавт з Радянського Союза полетів у космос 12 квітня, 1961, а перший астронавт з США полетів у космос 5 травня 1961."
"Ми вчимося мовам, а наші друзі бізнесу.","Ми вчимося мовам, а наші друзі вчаться бізнесу."
"Мої друзі поїдуть туда літаком, а я машиною.","Мої друзі поїдуть туда літаком, а я поїду машиною."
"Як тільки він поверне мою книгу сьогодні, то мені байдуже о котрій годині.","Як тільки він поверне мою книгу сьогодні, то мені байдуже о котрій годині він поверне мою книгу."
"Чоловік описує якесь місто, але нам неясно, яке.","Чоловік описує якесь місто, але нам неясно, яке місто чоловік описує."
"Я підготую матеріали на понеділок, а ти на вівторок.","Я підготую матеріали на понеділок, а ти підготуєш матеріали на вівторок."
"Там я уперше спробував сало, й ти теж.","Там я уперше спробував сало, й ти там уперше спробував сало теж."
"Жуков вів свою армію на Берлін з півночі, а Конєв з півдня.","Жуков вів свою армію на Берлін з півночі, а Конєв вів свою армію на Берлін з півдня."
"Іван пише книгу, а Микола музику.","Іван пише книгу, а Микола пише музику."
"Добрі студенти завжди роблять домашне завдання, а погані студенти ніколи.","Добрі студенти завжди роблять домашне завдання, а погані студенти ніколи не роблять домашне завдання."
"На 5-ому каналі прогноз погоди обіцяє трошки дощу, а на 8-ому каналі реальний ураган.","На 5-ому каналі прогноз погоди обіцяє трошки дощу, а на 8-ому каналі прогноз погоди обіцяє реальний ураган."
"У зоопарку я люблю дивитися на слонів, і мої сестри теж.","У зоопарку я люблю дивитися на слонів, і мої сестри теж люблять дивитися на слонів."
"Я розмовляю голосніше, ніж Іван.","Я розмовляю голосніше, ніж Іван розмовляє."
"Вони купили надувний замок, але не ясно кому.","Вони купили надувний замок, але не ясно кому вони купили надувний замок."
"Я не можу бачити без окуларів, а моя дівчина може.","Я не можу бачити без окуларів, а моя дівчина може бачити без окуларів."
"Кордон Фінландії з Росією довгий, з Норвегією короткий, а з Швецією - десь посередині.","Кордон Фінландії з Росією довгий, кордон Фінландії з Норвегією короткий, а кордон Фінландії з Швецією - десь посередині."
"Сорочка мені трошки завелика, а штани замалі.","Сорочка мені трошки завелика, а штани мені трошки замалі."
"Ніколи не хочу користуватися духовкою, тому що важко.","Ніколи не хочу користуватися духовкою, тому що користуватися духовкою важко."
"Ми поїдемо до парку машиною, а вони велосипедом.","Ми поїдемо до парку машиною, а вони поїдуть велосипедом."
"Вони запрошували мене піти на озеро, але я не мав часу.","Вони запрошували мене піти на озеро, але я не мав часу піти на озеро."
"Чи не можеш відповісти, чи просто просто не хочеш?","Чи не можеш відповісти, чи просто просто не хочеш відповісти?"
"Я розбив чашку, а сестра тарілку.","Я розбив чашку, а сестра розбила тарілку."
"Я розмовляю голосніше англійскою, ніж українською.","Я розмовляю голосніше англійскою, ніж я розмовляю українською."
Мої батьки мешкають у Чернігові і сестра теж.,Мої батьки мешкають у Чернігові і сестра теж мешкає у Чернігові.
"У зоопарку моя мати завжди любить дивитися на тюленів, а мій батько на пінгвінів.","У зоопарку моя мати завжди любить дивитися на тюленів, а мій батько завжди любить дивитися на пінгвінів."
"Лідія переїде в Харків, а ії сестра в Одесу.","Лідія переїде в Харків, а ії сестра переїде в Одесу."
"Я не готую так добре, як ти.","Я не готую так добре, як ти готуєш."
"Павло грає на скрипці, Данило на віолончелі а Петро роялі.","Павло грає на скрипці, Данило грає на віолончелі а Петро грає роялі."
"Я поставив йому три питання, і ти теж.","Я поставив йому три питання, і ти теж поставила йому три питання."
"Я сьогодні розмовляю голосніше, ніж учора.","Я сьогодні розмовляю голосніше, ніж я розмовляв учора."
