"Іван грає у футбол щодня, а я раз на місяць.","Іван грає у футбол щодня, а я граю у футбол раз на місяць."
"Я підготую матеріали на понеділок, а ти на вівторок.","Я підготую матеріали на понеділок, а ти підготуєш матеріали на вівторок."
"Вони запрошували мене піти на озеро, але я не мав часу.","Вони запрошували мене піти на озеро, але я не мав часу піти на озеро."
Я ненавиджу Марка і ти теж.,Я ненавиджу Марка і ти теж ненавиджиш Марка.
"Перший космонавт з Радянського Союза полетів у космос 12 квітня, 1961, а перший з США 5 травня 1961.","Перший космонавт з Радянського Союза полетів у космос 12 квітня, 1961, а перший астронавт з США полетів у космос 5 травня 1961."
"Іван щодня грає у футбол, і я теж.","Іван щодня грає у футбол, і я теж щодня граю у футбол."
"Вона вмерла у 1975, а ії чоловік на рік пізніше у 1976.","Вона вмерла у 1975, а ії чоловік вмер на рік пізніше у 1976."
"Іван пише книгу, а Микола музику.","Іван пише книгу, а Микола пише музику."
"Я його люблю, але не так сильно.","Я його люблю, але я його люблю не так сильно."
"Вони можуть бігати швидше, ніж я.","Вони можуть бігати швидше, ніж я можу бігати."
"Вона вбила його, але чим не знаємо.","Вона вбила його, але чим вона вбила його не знаємо."
"Він має уродини у червні, і вона теж.","Він має уродини у червні, і вона теж має уродини у червні."
"Федір часто знайомиться з новими людьми, а Олена рідко.","Федір часто знайомиться з новими людьми, а Олена знайомиться з новими людьми рідко."
"Щороку я перечитуваю ""Володара перснів"", а моя сестра ""Гобіта"".","Щороку я перечитуваю ""Володара перснів"", а моя сестра перечитуває ""Гобіта""."
"Я про все шкодую, а батько ні про що.","Я про все шкодую, а батько ні про що не шкодує."
"Я був на канікулах у Франції, сестра в Ірландії, а мої батьки у Швеції.","Я був на канікулах у Франції, сестра була на канікулах в Ірландії, а мої батьки були на канікулах у Швеції."
Я ненавиджу Марка і тебе теж.,Я ненавиджу Марка і тебе теж ненавиджу.
"Чоловік описує якесь місто, але нам незрозуміло, яке.","Чоловік описує якесь місто, але нам незрозуміло, яке місто чоловік описує."
"Добрі студенти завжди роблять домашне завдання, а погані студенти ніколи.","Добрі студенти завжди роблять домашне завдання, а погані студенти ніколи не роблять домашне завдання."
"Я приготував питання не тільки Радославу, але й Яні.","Я приготував питання не тільки Радославу, але й я приготував питання Яні."
"Мої друзі поїдуть туда літаком, а я машиною.","Мої друзі поїдуть туда літаком, а я поїду машиною."
"Вони ненавидять наш дім, але люблять свій.","Вони ненавидять наш дім, але вони люблять свій дім."
"Хоч ми хотіли порушити закон, ми не наважилися.","Хоч ми хотіли порушити закон, ми не наважилися порушити закон."
"На цій плантації вирощують, збирають, і обробляють алое, а на цій тютюн.","На цій плантації вирощують, збирають, і обробляють алое, а на цій плантації вирощують, збирають, і обробляють тютюн."
"Він добре розуміє математику, й біологію також.","Він добре розуміє математику, й він добре розуміє біологію також."
Чому?,Чому Іван стрибнув у криницю?
Батькові.,Батькові вони купили цю машину.
"В Америці ми прикрашаемо ялку на Різдво, а в Россії на Новий рік.","В Америці ми прикрашаемо ялку на Різдво, а в Россії прикрашають ялку на Новий рік."
"У дитинстві я грав у баскетбол, а мій приятель у бейсбол.","У дитинстві я грав у баскетбол, а у дитинстві мій приятель грав у бейсбол."
"Мій брат думає, що краще полювати з луком, ніж з гвинтівкою.","Мій брат думає, що краще полювати з луком, ніж полювати з гвинтівкою."
"Я не їм стільки, як він.","Я не їм стільки, як він їсть."
"Моя мати хоче новий комп'ютер, але ще не знає, якого бренду.","Моя мати хоче новий комп'ютер, але моя мати ще не знає, якого бренду моя мати хоче комп'ютер."
"У дитинстві я їв багато морозива, але зараз мало.","У дитинстві я їв багато морозива, але зараз я їм мало морозива."
"Моя дівчина завжди хоче ходити в кіно, а я николі не хочу.","Моя дівчина завжди хоче ходити в кіно, а я николі не хочу ходити в кіно."
"Розмоляю українською, але не дуже добре.","Розмоляю українською, але не дуже добре розмоляю українською."
"Я не вмію танцювати, а мій брат плавати.","Я не вмію танцювати, а мій брат не вміє плавати."
"Хочу поїхати за кордон, але не знаю куди.","Хочу поїхати за кордон, але не знаю куди поїхати."
"Максимові подобається чай, а Галині кава.","Максимові подобається чай, а Галині подобається кава."
"Як тільки він поверне мою книгу сьогодні, то мені байдуже о котрій годині.","Як тільки він поверне мою книгу сьогодні, то мені байдуже о котрій годині він поверне мою книгу."
"Я сьогодні розмовляю голосніше, ніж учора.","Я сьогодні розмовляю голосніше, ніж я розмовляв учора."
"У зоопарку моя мати завжди любить дивитися на тюленів, а мій батько на пінгвінів.","У зоопарку моя мати завжди любить дивитися на тюленів, а мій батько завжди любить дивитися на пінгвінів."
"На 5-ому каналі прогноз погоди обіцяє трошки дощу, а на 8-ому каналі реальний ураган.","На 5-ому каналі прогноз погоди обіцяє трошки дощу, а на 8-ому каналі прогноз погоди обіцяє реальний ураган."
"Він говорить з чужим акцентом, але ми не знаємо чому.","Він говорить з чужим акцентом, але ми не знаємо чому він говорить з чужим акцентом."
"Я вмію керувати човном, але не літаком.","Я вмію керувати човном, але не вмію керувати літаком."
"Я їм більше фруктів, ніж овочів.","Я їм більше фруктів, ніж я їм овочів."
"Незнайомий дав мені подарунок, але не знаю за що.","Незнайомий дав мені подарунок, але не знаю за що він дав мені подарунок."
"Мені подобаються майже всі страви з цього індійського ресторану, а моїй дівчині тільки одна.","Мені подобаються майже всі страви з цього індійського ресторану, а моїй дівчині подобається тільки одна страва з цього індійського ресторану."
"Сьогодні підемо в бар, але мені ще не сказали коли.","Сьогодні підемо в бар, але мені ще не сказали коли підемо в бар."
"Щось купили на ринку, але ще не сказали що.","Щось купили на ринку, але ще не сказали що купили."
"Подруга завжди рекомендує мені нову музику, але я ще слухаю стару.","Подруга завжди рекомендує мені нову музику, але я ще слухаю стару музику."
"Він придумав мелодію песни, а вона текст.","Він придумав мелодію песни, а вона придумав текст песни."
"Вона знає більше про свою країну, ніж він.","Вона знає більше про свою країну, ніж він знає про ії країну."
"Щодня вранці батько їсть пластівці, і ввечері також.","Щодня вранці батько їсть пластівці, і щодня ввечері батько їсть пластівці також."
"Там я уперше спробував сало, й ти теж.","Там я уперше спробував сало, й ти там уперше спробувала сало теж."
"Лідія каже, що Іван видалив файли випадково, а Марія каже, що навмисно.","Лідія каже, що Іван видалив файли випадково, а Марія каже, що Іван видалив файли навмисно."
"Моя мати хоче новий комп'ютер, але ще не знає, який.","Моя мати хоче новий комп'ютер, але моя мати ще не знає, який моя мати хоче комп'ютер."
"Закон в США забороняє володіння наркотиками, не вживання.","Закон в США забороняє володіння наркотиками, закон в США забороняє не вживання наркотиків."
"Ми дуже хочемо подорожувати по Україні, але зараз не можемо.","Ми дуже хочемо подорожувати по Україні, але зараз не можемо подорожувати по Україні."
"Я приготував питання не тільки до Радослава, але й до Яни.","Я приготував питання не тільки до Радослава, але й я приготував питання до Яни."
"Демократи голосують за законопроєкт, а республиканці проти.","Демократи голосують за законопроєкт, а республиканці голосують проти законопроєкту."
"Я хотів кращу шапку, не цю.","Я хотів кращу шапку, я не хотів цю шапку."
"Григорій готує макарони, а Олена песто.","Григорій готує макарони, а Олена готує песто."
"Там я уперше спробував сало, а ти зрази.","Там я уперше спробував сало, а ти там уперше спробував зрази."
"Він добре готує суп з м'ясом, а вона без мяса.","Він добре готує суп з м'ясом, а вона добре готує суп без мяса."
"Вони купили надувний замок, але не ясно кому.","Вони купили надувний замок, але не ясно кому вони купили надувний замок."
"Я сьогодні розмовляю голосніше, ніж Іван учора.","Я сьогодні розмовляю голосніше, ніж Іван розмовляв учора."
"Учора тут падав дощ, а не сніг.","Учора тут падав дощ, а учора тут падав не сніг."
"Я збираюся купити машину, а ти продати.","Я збираюся купити машину, а ти збираєшся продати машину."
"Кордон Фінландії з Росією довгий, з Норвегією короткий, а з Швецією - десь посередині.","Кордон Фінландії з Росією довгий, кордон Фінландії з Норвегією короткий, а кордон Фінландії з Швецією - десь посередині."
"Там я уперше спробував сало, а ти зрази.","Там я уперше спробував сало, а ти там уперше спробувала зрази."
"Я їм більше фруктів, ніж Михайло.","Я їм більше фруктів, ніж Михайло їсть фрукти."
"У 1950-ому році у Детройті мешкало понад 1,8 мільйона осіб, а вже у 2000-ому році менше мільйона.","У 1950-ому році у Детройті мешкало понад 1,8 мільйона осіб, а вже у 2000-ому році у Детройті мешкало менше мільйона."
"Ми поїдемо до парку машиною, а вони велосипедом.","Ми поїдемо до парку машиною, а вони поїдуть велосипедом."
"Журавлі літають швидше, ніж голуби.","Журавлі літають швидше, ніж голуби літають."
"Я поставив йому три питання, і ти теж.","Я поставив йому три питання, і ти теж поставила йому три питання."
"Він відремонтував моє авто, але я не розумію як.","Він відремонтував моє авто, але я не розумію як він відремонтував моє авто."
"Завтра я принесу лід, а ти пиво.","Завтра я принесу лід, а ти принесеш пиво."
"Я поставив йому три питання, а їй тільки два.","Я поставив йому три питання, а я поставив їй тільки два питання."
"На Різдво моя сестра готує вареники з картоплею, а я з м'ясом.","На Різдво моя сестра готує вареники з картоплею, а на Різдво я готую вареники з м'ясом."
"Я не можу бачити без окуларів, а моя дівчина може.","Я не можу бачити без окуларів, а моя дівчина може бачити без окуларів."
Тоді яке?!,Тоді яке морозиво хочеш?!
"В Україні зараз борються з ворогами, а зараз в Америці одне з одним.","В Україні зараз борються з ворогами, а зараз в Америці борються одне з одним."
"Я розбив чашку, а сестра тарілку.","Я розбив чашку, а сестра розбила тарілку."
Вона вважає його доброю людиною і він ії.,Вона вважає його доброю людиною і він вважає ії доброю людиною.
"Я розмовляю голосніше англійскою, ніж українською.","Я розмовляю голосніше англійскою, ніж я розмовляю українською."
"Мені треба прибрати кімнату для гостей сьогодні, а тобі завтра.","Мені треба прибрати кімнату для гостей сьогодні, а тобі треба прибрати кімнату для гостей завтра."
"Це речення вважається в англійській мові неправильним, але в українській правильним.","Це речення вважається в англійській мові неправильним, але це речення вважається в українській мові правильним."
"Григорій мешкає у Львові, а Дмитро у Києві.","Григорій мешкає у Львові, а Дмитро мешкає у Києві."
"Ми прийшли сюди тому, що ми хотіли.","Ми прийшли сюди тому, що ми хотіли прийти сюди."
"Ми хочемо піти на екскурсію до музею, а ви до театру.","Ми хочемо піти на екскурсію до музею, а ви хочете піти на екскурсію до театру."
"Мені подобаються майже всі страви з цього індійського ресторану, і моїй дівчині теж.","Мені подобаються майже всі страви з цього індійського ресторану, і моїй дівчині теж подобаються майже всі страви з цього індійського ресторану."
"Я зробив одну канапку уранці, й потім ще одну увечері.","Я зробив одну канапку уранці, й потім ще одну канапку зробив я увечері."
"Вона встала й вийшла, але ії чоловік не знав чому.","Вона встала й вийшла, але ії чоловік не знав чому вона встала й вийшла."
"Вони прийшли до мене не у середу, а у четверг.","Вони прийшли до мене не у середу, а вони прийшли до мене у четверг."
"Він завжди замовляє холодні страви, а вона гарячі.","Він завжди замовляє холодні страви, а вона завжди замовляє гарячі страви."
"Коти бавляться малими іграшками, а пси великими.","Коти бавляться малими іграшками, а пси бавляться великими іграшками."
"Я приправлю суп паприкою, а ти чорним перцем.","Я приправлю суп паприкою, а ти приправиш чорним перцем."
"Я добре розумію математику, але не біологію.","Я добре розумію математику, але я не добре розумію біологію."
"Моя дружина завжди приймає душ вранці, а я ввечері.","Моя дружина завжди приймає душ вранці, а я завжди приймаю душ ввечері."
"У понеділок ми читали першу частину роману, а у вівторок другу.","У понеділок ми читали першу частину роману, а у вівторок ми читали другу частину роману."
"Я не готую так добре, як ти.","Я не готую так добре, як ти готуєш."
"По понеділкам я ходжу з лекції до магазину вранці, а по п'ятницям ввечері.","По понеділкам я ходжу з лекції до магазину вранці, а по п'ятницям я ходжу з лекції до магазину ввечері."
"Батько не їсть зелену цібулю, тільки червону.","Батько не їсть зелену цібулю, батько їсть тільки червону цібулю."
"У зоопарку я люблю дивитися на слонів, і мої сестри теж.","У зоопарку я люблю дивитися на слонів, і мої сестри теж люблять дивитися на слонів."
"Ці квитки на концерт було куплено для нас, а не для вас.","Ці квитки на концерт було куплено для нас, а ці квитки на концерт не було куплено для вас."
"Ніколи не хочу користуватися духовкою, тому що важко.","Ніколи не хочу користуватися духовкою, тому що користуватися духовкою важко."
"Сорочка мені трошки завелика, а штани замалі.","Сорочка мені трошки завелика, а штани мені трошки замалі."
"Він сумнівається, що колись виграє у лото, але все одно сподівається.","Він сумнівається, що колись виграє у лото, але все одно сподівається колись виграти у лото."
"Там я уперше спробував сало, й ти теж.","Там я уперше спробував сало, й ти там уперше спробував сало теж."
"Перша людина з Радянського Союза полетіла у космос 12 квітня, 1961, а перша з США 5 травня 1961.","Перша людина з Радянського Союза полетіла у космос 12 квітня, 1961, а перша людина з США полетіла у космос 5 травня 1961."
"Данило та Павло використовують у спортзалі великі гантелі, а Іван малі.","Данило та Павло використовують у спортзалі великі гантелі, а Іван використовує у спортзалі малі гантелі."
"Я не вмію танцювати танґо, але хочу навчитися.","Я не вмію танцювати танґо, але я хочу навчитися танцювати танґо."
"Максимові подобається шоколад, а Галині цукерки.","Максимові подобається шоколад, а Галині подобаються цукерки."
"Я не хотів, але учора ми ходили в кіно.","Я не хотів ходити в кіно, але учора ми ходили в кіно."
"Я волію слухати його старі пісні, а не нові.","Я волію слухати його старі пісні, а я не волію слухати його нові пісні."
"Краще втратити цілий день, ніж цілий тиждень.","Краще втратити цілий день, ніж втратити цілий тиждень."
"Моя мати працює не тільки вдень, а і ввечері.","Моя мати працює не тільки вдень, а і працює ввечері."
"Віра й Олена читають газету, а Борис книгу.","Віра й Олена читають газету, а Борис читає книгу."
