"Кордон Фінландії з Росією довгий, з Норвегією короткий, а з Швецією - десь посередині.","Кордон Фінландії з Росією довгий, кордон Фінландії з Норвегією короткий, а кордон Фінландії з Швецією - десь посередині."
"На 5-ому каналі прогноз погоди обіцяє трошки дощу, а на 8-ому каналі реальний ураган.","На 5-ому каналі прогноз погоди обіцяє трошки дощу, а на 8-ому каналі прогноз погоди обіцяє реальний ураган."
"Данило та Павло використовують у спортзалі великі гантелі, а Іван малі.","Данило та Павло використовують у спортзалі великі гантелі, а Іван використовує у спортзалі малі гантелі."
"Він добре готує суп з м'ясом, а вона без мяса.","Він добре готує суп з м'ясом, а вона добре готує суп без мяса."
"Він відремонтував моє авто, але я не розумію як.","Він відремонтував моє авто, але я не розумію як він відремонтував моє авто."
"У 1950-ому році у Детройті мешкало понад 1,8 мільйона осіб, а вже у 2000-ому році менше мільйона.","У 1950-ому році у Детройті мешкало понад 1,8 мільйона осіб, а вже у 2000-ому році у Детройті мешкало менше мільйона."
"Ми вчимося мовам, а наші друзі бізнесу.","Ми вчимося мовам, а наші друзі вчаться бізнесу."
"Він має уродини у червні, і вона теж.","Він має уродини у червні, і вона теж має уродини у червні."
"Перша людина з Радянського Союза полетіла у космос 12 квітня, 1961, а перша з США 5 травня 1961.","Перша людина з Радянського Союза полетіла у космос 12 квітня, 1961, а перша людина з США полетіла у космос 5 травня 1961."
"Іван грає у футбол щодня, а я раз на місяць.","Іван грає у футбол щодня, а я граю у футбол раз на місяць."
"До піци я завжди додаю цібулю, а моя дівчина перець.","До піци я завжди додаю цібулю, а моя дівчина завжди додає перець."
"Вона мене не любить, а я ії.","Вона мене не любить, а я ії не люблю."
"Незнайомий дав мені подарунок, але не знаю за що.","Незнайомий дав мені подарунок, але не знаю за що він дав мені подарунок."
"Мої друзі поїдуть туда літаком, а я машиною.","Мої друзі поїдуть туда літаком, а я поїду машиною."
"Я люблю пиво, а ти вино.","Я люблю пиво, а ти любиш вино."
"Я поставив йому три питання, і ти теж.","Я поставив йому три питання, і ти теж поставив йому три питання."
"Григорій мешкає у Львові, а Дмитро у Києві.","Григорій мешкає у Львові, а Дмитро мешкає у Києві."
Я ненавиджу Марка і ти теж.,Я ненавиджу Марка і ти теж ненавиджиш Марка.
"Він сумнівається, що колись виграє у лото, але все одно сподівається.","Він сумнівається, що колись виграє у лото, але все одно сподівається, що колись виграє у лото."
Кожен рік він випадково розбиває чашку і його мати теж.,Кожен рік він випадково розбиває чашку і його мати теж кожен рік випадково розбиває чашку.
"Іван щодня грає у футбол, а я в теніс.","Іван щодня грає у футбол, а я щодня граю в теніс."
"Вони сміються, але не знаємо над ким.","Вони сміються, але не знаємо над ким вони сміються."
"Моя мати хоче новий комп'ютер, але ще не знає, який.","Моя мати хоче новий комп'ютер, але моя мати ще не знає, який моя мати хоче комп'ютер."
"Вона знає більше про свою країну, ніж він.","Вона знає більше про свою країну, ніж він знає про свою країну."
"Як тільки він поверне мою книгу сьогодні, то мені байдуже о котрій годині.","Як тільки він поверне мою книгу сьогодні, то мені байдуже о котрій годині він поверне мою книгу."
"Я хотів кращу шапку, не цю.","Я хотів кращу шапку, я не хотів цю шапку."
"Я спочатку приправлю суп паприкою, а потім чорним перцем.","Я спочатку приправлю суп паприкою, а потім я приправлю суп чорним перцем."
"Мені подобається ця пісня, але не знаю чому.","Мені подобається ця пісня, але не знаю чому мені подобається ця пісня."
"Вони ненавидять наш дім, але люблять свій.","Вони ненавидять наш дім, але вони люблять свій дім."
"Я приготував питання не тільки Радославу, але й Яні.","Я приготував питання не тільки Радославу, але й я приготував питання Яні."
"У понеділок ми читали першу частину роману, а у вівторок другу.","У понеділок ми читали першу частину роману, а у вівторок ми читали другу частину роману."
"Офіцери носять кашкети, а солдати прості пілотки.","Офіцери носять кашкети, а солдати носять прості пілотки."
Мої батьки мешкають у Чернігові і сестра теж.,Мої батьки мешкають у Чернігові і сестра теж мешкає у Чернігові.
"Я збираюся купити машину, а ти продати.","Я збираюся купити машину, а ти збираєшся продати машину."
"Він придумав мелодію песни, а вона текст.","Він придумав мелодію песни, а вона придумав текст песни."
"Щось купили на ринку, але ще не сказали що.","Щось купили на ринку, але ще не сказали що купили."
"Я зробив одну канапку уранці, й потім ще одну увечері.","Я зробив одну канапку уранці, й потім ще одну канапку зробив я увечері."
"Вони можуть бігати швидше, ніж я.","Вони можуть бігати швидше, ніж я можу бігати."
"Мені треба прибрати кімнату для гостей сьогодні, а тобі завтра.","Мені треба прибрати кімнату для гостей сьогодні, а тобі треба прибрати кімнату для гостей завтра."
