"В англійській мові неможливо зробити складний іменник з 20-и слів, а в німецкій можливо.","В англійській мові неможливо зробити складний іменник з 20-и слів, а в німецкій мові можливо зробити складний іменник з 20-и слів."
"Моя дочка хоче стати не просто простою бізнесменкою, а найбагатшою у світі.","Моя дочка хоче стати не просто простою бізнесменкою, а моя дочка хоче стати найбагатшою бізнесменкою у світі."
"Вони зараз розмовляють українською мовою, не російською.","Вони зараз розмовляють українською мовою, вони зараз не розмовляють російською."
"Іра не така модна, як Юля.","Іра не така модна, як Юля модна."
Мої батьки мешкають у Чернігові і сестра теж.,Мої батьки мешкають у Чернігові і сестра теж мешкає у Чернігові.
"Я більше п'ю віскі, ніж він горілку.","Я більше п'ю віскі, ніж він п'є горілку."
"Ми вчимося мовам, а наші друзі бізнесу.","Ми вчимося мовам, а наші друзі вчаться бізнесу."
"Я хотів чай з Китаю, не з Індії.","Я хотів чай з Китаю, я не хотів чай з Індії."
"Його вбили, але не знаю чому.","Його вбили, але не знаю чому його вбили."
"Я поставив йому три питання, і тобі теж.","Я поставив йому три питання, і я поставив тобі три питання теж."
Кожен рік він випадково розбиває чашку і його мати теж.,Кожен рік він випадково розбиває чашку і його мати теж кожен рік випадково розбиває чашку.
"Мені учора щось снилося, але не памятаю що.","Мені учора щось снилося, але не памятаю що мені снилося."
"Лідія переїде в Харків, а ії сестра в Одесу.","Лідія переїде в Харків, а ії сестра переїде в Одесу."
"Ми дуже хочемо подорожувати Україною, але зараз не можемо.","Ми дуже хочемо подорожувати Україною, але зараз не можемо подорожувати Україною."
"Жуков вів свою армію на Берлін з півночі, а Конєв з півдня.","Жуков вів свою армію на Берлін з півночі, а Конєв вів свою армію на Берлін з півдня."
"У минулому році ми вирощували тільки картоплю, але у цьому році і картоплю, і огірки.","У минулому році ми вирощували тільки картоплю, але у цьому році вирощуємо і картоплю, і огірки."
"Офіцери носять кашкети, а солдати прості пілотки.","Офіцери носять кашкети, а солдати носять прості пілотки."
"Я поставив йому три питання, і ти теж.","Я поставив йому три питання, і ти теж поставив йому три питання."
"Я в'їхав велосипедом у машину не два рази, а три.","Я в'їхав велосипедом у машину не два рази, а я в'їхав велосипедом у машину три рази."
"Чи не можеш відповісти, чи просто просто не хочеш?","Чи не можеш відповісти, чи просто просто не хочеш відповісти?"
"Я волію їсти зрази з яловичини, а ти з свинини.","Я волію їсти зрази з яловичини, а ти волієш їсти зрази з свинини."
"Вона знає більше про свою країну, ніж він.","Вона знає більше про свою країну, ніж він знає про свою країну."
"Іван посміхається, і Михайло знає чому?","Іван посміхається, і Михайло знає чому Іван посміхається?"
"Іван щодня грає у футбол, а я в теніс.","Іван щодня грає у футбол, а я щодня граю в теніс."
"Він сумнівається, що колись виграє у лото, але все одно сподівається.","Він сумнівається, що колись виграє у лото, але все одно сподівається, що колись виграє у лото."
"Павло грає на скрипці, Данило на віолончелі а Петро роялі.","Павло грає на скрипці, Данило грає на віолончелі а Петро грає роялі."
"Я спочатку приправлю суп паприкою, а потім чорним перцем.","Я спочатку приправлю суп паприкою, а потім я приправлю суп чорним перцем."
"Він має уродини у червні, а вона у жовтні.","Він має уродини у червні, а вона має уродини у жовтні."
"Я зробив канапку учора вранці, й потім ще раз ввечері.","Я зробив канапку учора вранці, й потім ще раз я зробив канапку ввечері."
"Я не вмію готувати так добре, як ти.","Я не вмію готувати так добре, як ти вмієш готувати."
"Вона мене не любить, а я ії.","Вона мене не любить, а я ії не люблю."
"Я люблю пиво, а ти вино.","Я люблю пиво, а ти любиш вино."
"Щодня вранці батько їсть пластівці, а ввечері стейк.","Щодня вранці батько їсть пластівці, а щодня ввечері батько їсть стейк."
"Мені подобається ця пісня, але не знаю чому.","Мені подобається ця пісня, але не знаю чому мені подобається ця пісня."
"Вони сміються, але не знаємо над ким.","Вони сміються, але не знаємо над ким вони сміються."
"США офіційно проголосили незалежність від Велико-Британії у 1783 році, а Україна від Радянського Союза у 1991 році.","США офіційно проголосили незалежність від Велико-Британії у 1783 році, а Україна офіційно проголосила від Радянського Союза у 1991 році."
Багато?,Багато п'ють німци пиво?
"До піци я завжди додаю цібулю, а моя дівчина перець.","До піци я завжди додаю цібулю, а моя дівчина завжди додає перець."
"Чоловік описує якесь місто, але нам неясно, яке.","Чоловік описує якесь місто, але нам неясно, яке місто чоловік описує."
"Я розмовляю голосніше, ніж Іван.","Я розмовляю голосніше, ніж Іван розмовляє."
